{"access":{"can_connect":true,"can_login":true,"expires_at":"2026-12-31T21:00:00Z","state":"active"},"api_version":"1","binding":{"egress_mode":"ipv4","id":"1","interface_id":"1","interface_name":"Основной","peer_id":"3","preferred_layer":"stray","route_mode":"standalone","slot":3,"tic_connection_mode":"dynamic"},"capabilities":{"connection_intent_recovery_v1":true,"dns46_dot":{"endpoint_ipv4s":["93.184.216.34"],"hostname":"dns.nelomai.ru","ready":true},"expires_at":"2026-08-28T18:05:00Z","revision":1},"connection":{"egress_mode":"ipv4","layer":"stray","lease_id":"11111111-1111-4111-8111-111111111111","pinned":false,"pool_id":"7","route_mode":"standalone","status":"warm","stopped_at":"2026-07-26T08:50:00Z","tic_connection_mode":"dynamic"},"defaults":{"layer":"stray","route_mode":"standalone","tic_connection_mode":"dynamic"},"device":{"id":"device_01","name":"Рабочий Mac","platform":"macos"},"pinned_stray":null,"request_id":"req_bootstrap_01","update":{"current_version":"0.1.0","minimum_version":null,"release_notes":null,"required":false,"update_available":false}}